{
    "project_id": "PROJ-001",
    "contract_id": "CTR-2025-XYZ",
    "project_title": "Barangay Road Improvement",
    "contractor_name": "Veritas Construction Inc.",
    "owner": "DPWH Region IV-A",
    "project_type": "PCCP Road",
    "start_date": "2025-11-01",
    "location": "San Juan, Batangas",
    "notes": "Phase 1 of the project"
}